,Topic Number,KTG
0,0,"eat, food, like, make, cook, get, meal, kid, thing, chees, tri, dinner, one, good, egg, want, fruit, chicken, give, veggi, peanut, love, go, meat, time, tast, littl, put, also, breakfast, plate, someth, start, much, day, anyth, would, butter, appl, rice"
1,1,"pictur, photo, look, phone, pic, video, camera, like, great, old, one, year, take, month, get, littl, nice, love, christma, shot, got, frame, email, son, photograph, day, awesom, print, first, use, good, see, realli, cute, time, babi, iphon, amaz, daughter, go"
2,2,"car, seat, belt, safeti, rear, carseat, instal, strap, face, use, check, back, safe, drive, accid, front, seatbelt, forward, clip, buckl, driver, fac, base, latch, side, passeng, sit, ride, crash, child, put, one, get, nom, system, booster, tighten, make, safer, fire"
3,3,"vader, shutter, darth, pooh, lightsab, yoda, harri, misogynist, knuckl, potter, hobbit, winni, nova, trilog, photogen, notif, duel, saber, disneyworld, skywalk, adob, replica, onedaughter, timeoh, spam, sw, tolkien, him, jedi, abbi, contrast, skit, stark, viral, novel, anh, flair, jim, stephen, mc"
4,4,"daddi, da, glass, brand, mommi, huggi, say, pamper, mama, costco, dada, sunglass, peppa, gerber, onsi, sunscreen, target, fireplac, momma, kirkland, tm, said, bye, daughter, cucumb, tree, like, mummi, heartwarm, ti, first, one, sam, get, call, coars, tongue, coupon, hound, month"
5,5,"imgur, jpg, forest, img, introduct, vampir, alik, jpeg, audit, rugrat, o, arthur, bonu, uniform, gif, harbour, gratz, q, j, imag, cape, mermaid, f, jpgimgur, lol, crochet, photoshoot, funthank, nolan, n, weekcongrat, p, l, pic, z, c, jpgone, wooki, u, h"
6,6,"star, war, ha, trek, luke, hahaha, jedi, alic, lili, rebel, evil, solar, faggot, font, moustach, autocorrect, iv, smurf, yall, tng, emperor, ep, machet, menac, rightthink, waygood, gramma, comed, chewbacca, myself, longev, nerd, anakin, gold, likeget, order, cthulhu, geniu, indiana, sparkli"
7,7,"song, sing, music, danc, listen, youtub, v, band, rock, album, beatl, lyric, cd, tune, love, bob, lullabi, zelda, playlist, sang, theme, radio, feature, hum, piano, classic, intro, dj, twinkl, favorit, calm, version, na, along, concert, watch, sunshin, sung, tast, simon"
8,8,"babi, bottl, sleep, swaddl, use, get, tri, one, help, work, month, also, blanket, like, feed, teeth, pacifi, crib, would, thing, us, good, first, give, make, cri, need, put, take, keep, seem, time, differ, r, much, reflux, start, go, lot, littl"
9,9,"girl, boy, littl, cute, congrat, look, like, daughter, dress, shirt, babi, birthday, man, love, ador, beauti, one, happi, wear, pink, gender, cake, awesom, parti, son, congratul, cloth, outfit, oh, dad, hat, got, day, doll, haha, blue, say, kid, great, color"
10,10,"doctor, get, like, sick, kid, ear, infect, thing, pediatrician, caus, normal, one, time, medic, test, pain, go, year, effect, month, got, son, child, would, also, start, worri, know, bad, realli, take, make, good, back, fever, need, say, someth, fine, problem"
11,11,"carter, sour, mcdonald, ronald, gari, congratulcongrat, cpap, brad, nicu, usyeah, such, preemi, congratbabi, youtu, spent, jane, preterm, picu, scbu, butterfli, oz, ventil, lb, week, born, daughter, month, get, home, great, littl, time, heartland, like, day, babi, wed, k, prematur, cyru"
12,12,"dog, door, bike, walk, one, put, get, use, cat, wall, climb, room, floor, hous, around, like, ride, crawl, lock, could, would, open, kid, top, paint, wheel, gate, stand, back, fall, got, toddler, go, train, slide, step, thing, stair, look, side"
13,13,"circumcis, risk, reason, studi, would, cut, medic, research, decis, done, health, issu, one, son, benefit, peni, peopl, like, babi, make, infant, foreskin, use, sex, evid, male, doctor, men, bodi, also, think, choic, even, procedur, mani, much, org, get, inform, opinion"
14,14,"tooth, fairi, coin, bummer, clau, wholesom, easter, revolut, bunni, idl, gangster, santa, teeth, zoe, snif, figurin, magic, toolbox, bobbi, blackmail, prouder, underground, pillow, mia, cheerlead, layout, favorite, dollar, eri, elv, beak, tak, babilike, letter, innard, believ, yessir, wheels, oldhaha, lost"
15,15,"smile, sock, barrel, match, grin, melt, ski, swiss, pair, donald, maui, energ, goo, namethank, laugh, pavement, happenknow, snowboard, lh, teh, giggl, wait, lolgood, onelove, hamilton, suspici, earnest, quad, ga, leonardo, love, awe, goofi, neurosurgeon, congratknow, wang, she, littl, cute, start"
16,16,"diaper, chang, cloth, use, tabl, bag, wipe, room, one, dispos, babi, men, bathroom, place, women, pad, wash, toilet, laundri, like, trash, station, restroom, clean, dirti, size, put, poop, manag, ladi, nappi, restaur, shit, floor, also, need, go, never, insert, get"
17,17,"first, month, one, time, wife, babi, week, get, go, feel, day, thing, good, best, life, pregnanc, born, littl, know, pregnant, realli, twin, like, much, make, luck, second, two, everi, man, still, got, sure, year, enjoy, us, congrat, worri, new, lot"
18,18,"beer, helmet, coast, west, brew, asian, francisco, bra, willi, semen, portland, san, canyon, denver, rec, hehe, python, skull, tiniest, swish, sip, likewife, sf, lookin, processor, subtract, peddl, rehears, guinea, redhead, cutesi, rad, inflat, elderli, reddiquett, elsa, tribut, gobbl, flat, miniatur"
19,19,"book, read, word, languag, sign, talk, start, learn, say, speak, month, develop, son, age, realli, speech, use, teach, stori, like, letter, thing, kid, one, earli, point, sound, commun, english, also, hear, know, get, good, think, differ, time, write, help, understand"
20,20,"lawyer, scout, court, law, state, religi, legal, custodi, church, christian, faith, religion, attorney, file, cp, polic, atheist, believ, document, servic, report, child, illeg, judg, troop, leader, govern, jesu, record, militari, local, feder, amic, mediat, cub, cathol, calendar, case, belief, ex"
21,21,"hope, know, feel, sorri, go, famili, pain, wife, man, get, strong, heart, help, loss, imagin, like, wish, time, son, littl, need, best, one, even, thank, love, day, would, keep, us, hear, life, thought, good, thing, make, take, guy, stay, right"
22,22,"like, one, daughter, costum, love, kid, look, paw, old, littl, say, son, word, blue, get, patrol, guitar, go, mask, call, halloween, swear, voic, pj, got, metal, use, know, right, black, year, white, realli, rock, make, hear, think, punk, see, fuck"
23,23,"princess, liam, ringer, snake, judo, lemonad, headfirst, thailand, princ, chiropract, republ, indoctrin, disney, like, mcstuffin, hiccup, savor, time, littl, babi, would, sleep, one, thing, go, make, daughter, get, think, petit, hic, much, need, girl, white, good, look, guy, want, work"
24,24,"trip, go, get, take, park, time, one, kid, travel, flight, around, like, bring, hour, old, walk, month, plane, summer, area, day, camp, littl, nice, fli, sit, took, pack, place, live, zoo, drive, shoe, make, thing, beach, also, snack, good, back"
25,25,"money, pay, cost, insur, save, bill, tax, k, expens, paid, colleg, plan, account, fund, financi, budget, year, cover, per, get, dollar, privat, payment, credit, afford, bank, educ, spend, pocket, deduct, school, state, debt, use, amount, cash, free, invest, qualifi, month"
26,26,"cuti, grayson, pose, pollut, hazel, stout, transcrib, banana, stinkin, title, subject, techi, oldlittl, aroundget, nicotin, ingredients, satir, to, crinkl, juici, messag, gimp, faq, transcript, everyeah, reddit, buffalo, statist, link, amp, huckleberri, explan, jpgrealli, creator, feedback, suggest, huck, error, report, mistak"
27,27,"amp, use, one, amazon, sr, get, like, dp, b, monitor, also, work, ref, babi, set, product, ie, good, look, video, r, utf, kid, camera, great, app, got, buy, go, qid, need, realli, phone, well, would, make, bought, someth, want, check"
28,28,"vaccin, shot, flu, pertussi, immun, booster, anti, cdc, autism, outbreak, remak, schedul, raffi, diseas, pox, cough, comet, beethoven, get, viru, inject, die, northwest, revok, pacif, risk, allegi, strain, sting, got, parentthink, germ, kid, danger, sick, caus, map, children, system, effect"
29,29,"wife, hospit, birth, babi, week, nurs, go, born, c, labor, home, nicu, doctor, section, littl, first, day, hour, good, get, went, like, got, one, well, thing, deliveri, time, us, room, look, came, come, everyth, see, pain, much, want, hope, best"
30,30,"babi, get, feel, help, thing, time, like, wife, need, go, take, make, tri, realli, better, month, much, first, know, talk, start, way, even, chang, think, want, lot, also, good, sleep, cri, one, work, hard, littl, stress, someth, give, advic, depress"
31,31,"kid, like, parent, get, think, go, want, thing, peopl, know, would, make, say, child, time, way, need, one, someth, tri, even, realli, see, feel, good, tell, take, let, work, talk, ask, give, children, come, wife, person, said, also, never, much"
32,32,"get, buy, babi, go, one, stuff, thing, need, use, wife, store, like, make, time, also, kid, take, good, much, shop, cloth, would, hous, day, realli, bag, pack, bought, someth, want, lot, got, new, car, room, put, first, cheap, etc, keep"
33,33,"sleep, night, hour, get, time, day, wake, go, nap, month, bed, week, work, pm, start, everi, feed, old, routin, babi, morn, back, minut, one, schedul, like, wife, good, tri, need, would, around, littl, much, us, take, eat, last, slept, bedtim"
34,34,"scienc, org, like, site, use, articl, look, link, would, peopl, think, content, also, make, compani, actual, one, websit, ad, uk, wikipedia, market, kid, children, googl, edit, get, r, amp, public, en, show, wiki, search, claim, imag, design, to, draw, part"
35,35,"face, like, laugh, look, eye, hand, old, littl, daughter, month, son, one, head, get, mouth, finger, start, thing, kid, nose, time, babi, tri, make, love, funni, got, grab, think, ball, cute, would, put, say, hilari, go, feet, see, around, still"
36,36,"year, kid, old, like, get, time, one, daughter, love, littl, son, dad, look, go, month, thing, good, got, day, think, make, much, first, realli, see, want, still, would, know, start, great, say, two, boy, girl, way, never, age, take, around"
37,37,"santa, beard, fan, easter, proclaim, firework, engrav, thumbnail, holiday, deceas, toenail, bunni, christma, sox, mustach, endear, spawn, blackout, lamin, placement, prank, subway, sydney, lightroom, oneson, muff, ink, melbourn, championship, graciou, mall, unimpress, vid, sphere, jk, unlimit, season, secret, shave, plumber"
38,38,"milk, feed, formula, breast, breastfeed, pump, wife, bottl, babi, lactat, consult, mom, get, breastfe, boob, nippl, fed, supplement, latch, enough, nurs, produc, suppli, breastmilk, much, week, breastf, mother, month, eat, also, use, tri, weight, would, day, help, first, one, support"
39,39,"name, like, middl, call, first, son, wife, spell, one, pick, list, boy, also, daughter, girl, great, think, love, sound, born, last, would, comic, go, babi, august, wikipedia, wiki, famili, realli, john, nicknam, popular, en, want, lt, e, good, use, grandfath"
40,40,"work, time, day, get, home, wife, week, take, go, month, job, stay, leav, hour, daycar, need, care, first, much, thing, help, back, kid, one, babi, like, make, start, hous, spend, famili, realli, would, two, feel, come, even, everi, also, lot"
41,41,"pool, swim, podcast, bitten, water, dunk, lesson, biter, ctrl, abstin, invok, underwat, float, alt, class, raider, thug, keg, harmonica, hellion, az, perch, indign, donethank, brazilian, unscrew, straw, shortcut, suspens, loveknow, unclear, terrain, lucr, floss, slope, bait, overdr, checker, playtex, teach"
42,42,"pierc, ear, gmail, dm, pellet, llama, caption, contempt, daylook, empt, bubbl, sleepcongrat, directori, ridg, ella, herp, pcp, oldmonth, dean, domain, modif, stripe, encapsul, arya, cultur, tyler, loc, account, hearti, inbox, amelia, babi, get, circumcis, think, like, make, inocul, done, problemlook"
43,43,"post, r, like, pictur, reddit, daddit, dad, look, pic, see, thank, comment, sub, subreddit, link, cute, downvot, share, good, kid, babi, upvot, peopl, one, facebook, get, photo, think, thought, pleas, guy, awesom, vote, blog, great, new, op, ment, make, thread"
44,44,"sleep, cri, bed, get, night, time, month, back, babi, asleep, room, put, go, like, fall, old, would, minut, crib, one, wake, first, start, still, tri, let, work, kid, scream, wife, thing, littl, daughter, us, everi, son, around, week, realli, nois"
45,45,"get, poop, water, use, like, clean, time, go, bath, one, potti, day, diaper, wash, pee, tri, start, make, would, put, littl, month, thing, cup, got, smell, take, old, son, toilet, kid, everi, train, hand, think, shit, never, babi, still, good"
46,46,"me, squirrel, spider, mayor, antsi, popper, misunderstood, parasit, humid, pooper, advert, amd, exasper, invinc, which, ricki, scarf, bil, snappi, lovethank, compris, generos, andi, twig, tru, pineappl, probe, voodoo, nm, unwrap, newbi, melon, sweeten, steami, insect, om, atticu, disco, themself, plung"
47,47,"play, game, get, kid, time, like, toy, video, thing, use, go, make, also, watch, fun, want, love, one, someth, old, tri, tv, lego, good, learn, start, let, realli, interest, stuff, control, would, son, lot, much, work, set, activ, find, year"
48,48,"dad, father, mother, mom, men, child, sex, women, like, would, get, relationship, life, make, good, famili, ex, want, right, parent, marri, go, one, need, wife, thing, year, even, live, think, adopt, husband, work, divorc, time, daughter, custodi, man, support, love"
49,49,"fish, tank, rod, goate, ghost, scowl, aquarium, buff, pole, grat, brightli, redund, cocain, different, speechless, poem, catch, caught, mach, sin, phototherapi, cast, pang, babibabi, tore, forgiv, fractur, armpit, rapid, hook, harrow, sacr, monkey, hope, get, soo, sorri, like, help, one"
50,50,"watch, show, tv, movi, kid, episod, love, like, youtub, disney, anim, one, gabba, netflix, charact, old, dinosaur, cartoon, pig, tiger, mr, dora, yo, thoma, son, monster, street, sesam, good, go, time, elmo, seen, theme, film, song, think, georg, littl, get"
51,51,"month, lb, oz, weight, drink, size, alcohol, smoke, pound, th, big, week, old, weigh, babi, height, born, percentil, teeth, son, gain, tall, inch, kid, bigger, grow, year, like, chart, fat, littl, two, start, fit, still, growth, long, averag, look, small"
52,52,"babi, use, carri, wrap, carrier, stroller, wear, one, walk, like, hold, leg, around, get, back, sling, arm, hand, ergo, bjorn, backpack, shoulder, mobi, hip, look, head, fit, strap, also, love, got, littl, weight, realli, comfort, good, hike, great, much, way"
53,53,"car, seat, drive, kid, van, one, fit, vehicl, like, get, minivan, back, space, look, honda, row, also, need, wife, road, rear, ga, suv, wagon, toyota, two, jeep, new, got, v, year, go, mileag, outback, would, truck, great, mini, love, ride"
54,54,"gun, shoot, firearm, weapon, rifl, jason, brown, bb, aboard, ting, psi, misspel, coincident, olivia, cinema, ammo, safeti, torch, grey, wellcongrat, girlcongrat, trigger, frown, el, blond, eye, blue, thanklook, documentari, bullet, countri, congratulcute, arithmet, had, cheer, congratul, solidli, like, girl, archetyp"
55,55,"pac, dentist, whoop, pixel, transplant, thinkgeek, cowboy, dat, eczema, sprinkler, marley, denmark, dub, templat, foo, curious, ur, elvi, dental, daylove, ungodli, spiderman, crab, hep, sonthank, pluto, broom, pacman, oneawesom, caviti, both, furrow, paramet, brow, pid, dalla, dan, cut, knife, silki"
56,56,"shark, sandal, korean, skate, boot, snow, wellgood, gopro, beta, bib, barber, stach, gimm, cig, invis, tripod, korea, cruiser, elf, unse, diaperdud, tu, bryan, glove, dailymail, wallet, years, ohh, hk, banist, elast, etch, these, dadgear, chines, dimens, swag, rite, hail, japanes"
57,57,"hair, look, cut, brush, shave, head, like, get, daughter, braid, skin, hat, use, haircut, nail, littl, bald, ponytail, clip, long, good, pull, tail, poni, keep, trim, comb, got, mm, tie, one, cap, practic, strawberri, back, razor, len, make, knot, grow"
58,58,"gift, ring, flower, necklac, mother, jewelri, mop, present, stud, eyebrow, bracelet, wed, fur, footprint, leash, frame, patch, awesomthank, willow, stone, charm, retriev, someth, jurass, firefli, birthston, wife, diamond, like, outstand, applianc, got, nigh, constrict, sentiment, get, deadli, hand, wrinkl, babi"
59,59,"tattoo, dope, sahp, gel, comedian, copyright, wa, smoosh, gateway, dadgood, slayer, unnot, regim, teammat, guyyeah, future, woo, aerosmith, thoughwell, cheerthank, surrend, bluntli, sherlock, olymp, familiyeah, snope, clos, yearyeah, puf, feeler, alaska, smuggl, like, wildlif, chopper, betterknow, galleri, time, definitli, workactual"
